Male;Employee;Others;January;level access scissor perform sustain activity drilling drill install lifting electrowelde mesh square meter 6 m 2 m weight kg approximately team platform assistant slip feel pain inner edge right knee;3;Assistant;Perform, Sustain activity, Drill, Install;Scissor lift, Drill, Electroweld mesh, Platform
Male;Third Party;Fall prevention;January;auxiliary general service month day work perform activity soil collection movement equipment point hold lever encounter piece slope ground interlace vegetation cause fall leave tool hold rapid fall prevent employee lean cause shock elbow ground employee continue activity point sample collection feel arm bother;4;Auxiliary, General Service;Perform activity, Collection of soil, Hold lever, Encounter piece, Move equipment, Interlace vegetation, Prevent fall, Lean, Cause shock, Continue activity, Feel bother;Lever
Male;Third Party (Remote);Manual Tools;January;reduction activity tube employee attach tube walrus hit tube hammer untie walrus reach finger;2;Employee;Attach, Hit, Untie, Reach;Tube, Walrus, Hammer
Male;Third Party;Projection;January;activity settle concrete block ventilation plug wall cx level circumstance Employee set union concrete block polyethylene pipe diameter pick spike hit hit Employee protector;4;Employee;Set concrete block, Hit, Place, Set;Ventilation plug, Concrete block, Polyethylene pipe, Pick spike, Protector
Male;Employee;remains of choco;January;level tajo area complete drilling drill loading operator remove bit jumbo arm walk crew cabin crown work fragment rock pass cocada mesh and impact helmet rebound hit right shoulder operator generate describe injury;3;Operator, Crew;Complete drilling, Remove bit, Walk, Pass, Impact, Rebound, Hit;Drill, Jumbo arm, Helmet, Cocada mesh
Male;Employee;Liquid Metal;January;approach furnace process melt ingot strike liquid metal projection;4;Employee;Approach, Melt, Strike;Furnace, Ingot, Liquid metal
Male;Employee;Others;January;routine slimme activity kiln battery employee begin remove waste inside crucible aid skimmer feel pain leave shoulder;4;Employee;Begin, Remove, Aid;Kiln, Crucible, Skimmer
Male;Third Party (Remote);Fall prevention;January;hour mr moinsac carry work assemble water line climb cat ladder approximate height meter vanishe fall hit way transfer medical center attention;4;Employee;Carry, Assemble, Climb;Water line, Cat ladder
Male;Third Party;Manual Tools;January;manipulate material master drill truck operator decide space move radiator moment driver truck imprison little finger leave hand bar;3;Operator;Manipulate material, Decide, Move, Imprison, Leave;Master drill, Radiator, Bar
Male;Third Party (Remote);Others;January;employee engage removal material excavation level shovel placing bucket day material fall pipe employee boot friction boot calf cause superficial injury leg;1;Employee;Engage removal, Excavation, Place, Fall, Cause;Shovel, Bucket, Shovel
Male;Third Party (Remote);Others;January;employee engage removal material excavation level shovel placing bucket day material fall pipe employee boot friction boot calf cause superficial injury leg;1;Employee;Engage removal, Excavation, Place, Fall, Cause;Shovel, Bucket, Shovel
Male;Third Party;remains of choco;January;be 179th block moment messrs injure clean 14th drill radial mesh incline shape right gable moment detache fragment rock 5x5x2 cm impact shoulder;4;Employee;Injure, Clean, Detach, Impact;Drill, Radial mesh, Rock fragment
Male;Third Party (Remote);Fall;January;employee transit grs area come slip suffering twist leave knee;3;Employee;Transit, Slip, Suffering, Twist;grs area
Male;Third Party;Venomous Animals;January;be activity collect soil collaborator run branch attack maribondo bite twice head pain swell allergic symptom continue activity;1;Collaborator;Collect soil, Run, Attack, Bite, Continue activity;collect soil
Male;Third Party;Others;January;time collaborator pass tubo pvc pipe loader uncover fifth hole obstruct piece rock operator accidentally activate air valve cause loading pipe floor rise suddenly throw pril anfo excess pipe cheekbone eyelid right eye victim;3;Collaborator, Operator;Pass, Uncover, Obstruct, Activate, Cause, Load, Throw;PVC pipe, Loader, Air valve, Pril anfo
Male;Third Party;Vehicles and Mobile Equipment;January;circumstance tipper mv move nv nv operator see congestion equipment unit ramp distance meter access nv decide cab turn vehicle suddenly slide second rung ground hit right forearm region fender rung;3;Operator;Move, See, Decide, Turn, Slide, Hit;Vehicle
Male;Employee;Vehicles and Mobile Equipment;January;moment enter mouth tunel employee move leave locomotive lt locomotive personnel transfer station entrance mouth noticing protrude abutment say locomotive hit right knee metal stirrup note operator continue duty watch reporting happen be extraction supervisor notice discomfort partner knee immediately evacuate natclar reporting control center;3;Operator, Supervisor;Move, Transfer, Notice, Hit, Continue, Watch, Report, Evacuate;Locomotive, Metal Stirrup
Male;Employee;Others;January;assembly activity polypropylene pipe diameter employee step pipe flange twist right foot;3;Employee;Step, Twist;Polypropylene Pipe, Flange
Male;Employee;Vehicles and Mobile Equipment;January;enter interior bodeguero locate litorina convoy displacement litorina derail advance approximately meter operator observe event enter entrance gate paralyze displacement convoy winemaker epps on;4;Bodeguero, Operator, Winemaker;Locate, Observe, Enter, Displace, Derail, Advance;Litorina (train), Entrance Gate
Male;Third Party;Projection/Choco;February;be perform soil activity collaborator pickaxe assist open collection hole strike ferranta ground fragment rock project forehead cause small cut activity paralyze moment necessary doctor employee continue activity normally;2;Collaborator;Perform, Assist, Open, Strike, Collect, Paralyze, Continue;Pickaxe, Ferranta (ground fragment), Collection Hole
Male;Employee;Manual Tools;February;employee perform drilling activity lm17 probe level gps position needle stem come hit left hand ring finger retraction box cause superficial injury;3;Employee;Perform, Hit, Retract, Cause, Injure;LM17 Probe, GPS, Needle Stem, Box
Male;Employee;Others;February;pm perform geological mapping activity geologist accompany geologist luciano do santo dayme crossing fence barb wire know region goat fence base 60 cm height rod interlace horizontally upwards little barbed wire barb 20 cm jump fence fence manage sweep vegetation leave foot support foot ground stump approximately 10 cm 1 cm come break sole boot cause perforation leave foot height finger;2;Geologist;Perform, Accompany, Cross, Jump, Manage, Sweep, Leave, Break, Cause, Perforate;Barb Wire, Fence, Boot
Male;Third Party;Others;February;collaborator complete misalignment nut leave chute scraper strip no get turn hit head guard rail hit lense generate injury;2;Collaborator;Complete, Leave, Strip, Get, Turn, Hit, Generate;Nut, Chute, Scraper, Guard Rail, Lense
Male;Employee;remains of choco;February;Employee perform chuteo ore hopper second car perceive slip water mud hopper decide leave platform second rung ladder access water increase fragment rock slide hit Employee cause fall hit right forearm leave knee;5;Employee;Perform, Perceive, Slip, Decide, Leave, Access, Increase, Slide, Hit, Cause, Fall;Chute, Hopper, Ladder
Male;Third Party;Cut;February;hour approximately circumstance administrative ssomac arrange guillotine right center table cut enmicada page try raise guillotine middle finger right hand rub edge guillotine blade cause cut yolk finger right hand;4;Administrative;Arrange, Cut, Try, Raise, Rub, Cause;Guillotine, Page
Female;Third Party;Others;February;preparation office cleaning activity employee use stair rail contact clamp lock signaling board;2;Employee;Use, Contact;Stair rail, Clamp, Lock, Signaling board
Male;Third Party (Remote);Pressed;February;activity package cylindrical piece easel employee carry piece designate place finger press metal piece move;1;Employee;Carry, Designate, Press, Move;Easel, Metal piece
Male;Third Party;Cut;February;injure collaborator colleague want rim scoop tire strength throw rim floor roll instant eyelash hit fifth finger right hand ring produce injury;3;Collaborator, Colleague;Throw, Roll, Hit, Produce;Rim, Scoop, Tire
Male;Employee;Machine Protection;February;average am operator remove clean accessory mobile channel line support leave hand rail motion moment crush 2nd finger leave hand occur injury occur collaborator refer medical care;3;Collaborator, Operator;Remove, Clean, Leave, Crush, Occur;Accessory, Mobile Channel, Support, Rail
Male;Third Party (Remote);Power lock;February;circumstance Employee clean use absorbent cloth oil residue right edge axs compressor bonnet open function rag fall inside ompressor attempt remove it hook fan propeller pull Employee leave hand propeller cause injury;5;Employee;Clean, Use, Fall, Attempt, Remove, Pull, Cause Injury;Compressor, Absorbent Cloth, Rag, Hook, Fan Propeller
Male;Third Party (Remote);Manual Tools;February;perform carpentry work collaborator hit second finger leave hand hammer hold right hand cause bruise height nail evaluation carry medical center unit final diagnosis contusion finger;1;Collaborator;Perform, Hit, Hold, Cause Bruise, Carry, Evaluation;Hammer
Male;Employee;Pressed;February;prepare mount polypropylene tubing employee pull pickup truck position place press finger tube concrete wall;3;Employee;Prepare, Pull, Position, Place, Press;Polypropylene Tubing, Pickup Truck
Male;Employee;Projection;February;maintenance peristaltic pump 02bp0166 change internal hose rupture tubing reserve pump 02bp0167 rupture start operate designing solution heat employee reach left forearm cause irritation skin;4;Employee;Change, Operate, Reach;Peristaltic Pump, Internal Hose, Tubing
Male;Employee;Burn;February;maintenance peristaltic pump 02bp0166 change internal hose rupture tubing reserve pump 02bp0167 disrupt start operate designing solution heat employee reach left forearm cause burn;4;Employee;Change, Operate, Reach;Peristaltic Pump, Internal Hose, Tubing
Male;Third Party;Pressed;February;nv south mechanic loosens bolt intermediate cardan protector dumper protector release imprison finger leave hand connector hydraulic steering cylinder position;5;Mechanic;Loosen, Release, Imprison;Bolt, Cardan Protector, Dumper Protector, Hydraulic Steering Cylinder
Male;Third Party;Venomous Animals;February;pm perform magnetometric gps collaborator bump field hat branch attack maribondo bitten ear shoulder continued activity feel pain swelling;1;Collaborator;Perform magnetometric GPS;Magnetometric GPS
Female;Third Party (Remote);Fall;February;average office ajani prepare store folder warehouse place come iglu go step diagonally sit leave foot edge second step cause foot bend leave inward stabilize quickly avoid fall ground;2;Office Employee;Prepare, Place, Go, Step, Sit, Leave, Cause, Bend, Stabilize, Avoid Fall;Folder, Warehouse, Iglu
Male;Third Party;Projection/Manual Tools;February;moment extract bolt chuck rotation unit vsd instant hit rope 6lbs base support bolt fragment metal structure project impact face mechanic describe injury;3;Mechanic;Extract, Hit, Project, Describe;Bolt, Chuck, Rope, Metal Structure
Male;Employee;Chemical substances;February;paint pumping pipe complete person involve involuntarily touch face hand with glove paint clean make use dry industrial cloth begin rub face period time second continuously finally paint face clean friction generate describe injury;3;Employee;Touch, Rub, Clean, Use, Begin, Generate, Describe;Glove, Dry Industrial Cloth
Male;Third Party;Projection;February;conclusion unload ore amp plate pit driver notice stretch support mesh stuck hopper hatch driver get equipment with hopper lift remove hand mesh generating force fine particle rock fall impregnated eye injure time incident injure person measure glass surcharge;4;Driver;Notice, Stretch, Get, Lift, Remove, Generate, Fall, Impregnate, Injure, Measure;Equipment, Hopper, Mesh, Glass
Male;Third Party;Vehicles and Mobile Equipment;February;mr put tool hopper truck park cruise level ob2b mining operation van arrive drive engineer park truck approximately meter having place safety block go request datum drill later assistant simba open gate dropping bit hopper truck untimely vehicle move forward pin mechanic right leg;4;Engineer, Assistant, Mechanic;Put, Park, Arrive, Drive, Request, Open, Drop, Move, Forward;Truck, Tool, Safety block, Datum drill, Pin
Male;Third Party (Remote);Venomous Animals;February;transport piece wood aid wheelbarrow employee feel prick right leg moment stop activity remove legging shake pant notice small scorpion;3;Employee;Transport, Feel, Stop, Remove, Shake, Notice;Wheelbarrow
Male;Third Party (Remote);Fall;February;mining cycle chimney start drill work anchor lane alimak system collaborator squat pick manual tool platform moment jackleg team lose position project collaborator generating injury;4;Collaborator;Start, Work, Squat, Pick, Lose Position, Project, Generate Injury;Manual Tool, Jackleg, Alimak System
Male;Employee;Projection;February;support process circumstance assistant perform cut transverse length mesh mesh generate movement operator hit face cause described injury;3;Assistant, Operator;Perform, Cut, Generate Movement, Hit, Cause Injury;Mesh
Male;Third Party;Venomous Animals;February;pm assist gps magnetometric collaborator bump field hat branch attack maribondo moth go eye use sunglass attack region prevent insect move face getting catch ear field hat make helper bite ear allergic marimbondo bite soon activity immediately paralyze drove car accident take medicine antiallergic situation work indicate doctor avoid swell responsible project field mapping activity call radio immediately assistant feel good take emergency hospital lavra sul consult doctor take antiallergic release;1;Collaborator, Assistant, Helper;Assist, Bump, Attack, Use, Prevent, Move, Catch, Make, Bite, Consult, Take, Call, Feel, Drive;GPS, Magnetometric, Hat, Sunglass, Medicine, Radio
Male;Third Party;Fall;February;moment staff impromec company head pique support shotcrete casting job electrician identify lane water road right leg enter gutter depth cause injury service litorina paralyze entrance personnel;3;Staff, Electrician;Identify, Enter, Cause, Paralyze;Shotcrete, Casting Job, Support
Male;Employee;Fall prevention;February;employee descend ladder inspection milling cyclone give access floor mill platform iscmg26 floor give way fall height approximately meter meter there material ore platform decrease height fall impact;4;Employee;Descend, Inspect, Fall, Impact;Ladder, Milling Cyclone, Platform
Male;Third Party;remains of choco;February;area ​​lloclla meter substation nro circumstance Employee prepare pick rope floor fragment rock slide slope hill fragment diameter approximately impact face Employee produce aforementioned injury;4;Employee;Prepare, Pick, Slide, Impact, Produce;Rope
Male;Employee;Others;February;perform clean activity area near tc grinding employee handle block triangular shape rock measure 53 cm 42 cm 12 cm movement lose balance fall rock thumb leave hand injure he;4;Employee;Perform, Clean, Handle, Lose balance, Fall, Injure;Block, Rock
Male;Third Party (Remote);Others;March;carry refractory brick chop activity order place support bus bar section particle detach hit assistant right arm meter away work area provoke wound arm treat medical center return usual duty;1;Assistant;Carry, Chop, Place, Detach, Hit, Provoke, Treat;Refractory brick, Bus bar, Section particle
Male;Third Party;Venomous Animals;March;soil sample region employee danillo silva attack bee test rush away place employee take bite chin chest neck hand glove employee take bite hand glove head employee danillo take bite leave arm uniform sketch allergy swell ste site activity stop evaluate site verifying test remain line leave site;1;Employee;Attack, Rush away, Take, Bite, Evaluate, Verify, Stop, Remain, Leave;Glove, Uniform
Male;Third Party;Venomous Animals;March;soil sample region employee danillo silva attack bee test rush away place employee take bite chin chest neck hand glove employee take bite hand glove head employee danillo take bite leave arm uniform sketch allergy swell ste site activity stop evaluate site verifying test remain line leave site;1;Employee;Attack, Rush away, Take, Bite, Evaluate, Verify, Stop, Remain, Leave;Glove, Uniform
Male;Third Party;Venomous Animals;March;soil sample region employee danillo silva attack bee test rush away place employee take bite chin chest neck hand glove employee take bite hand glove head employee danillo take bite leave arm uniform sketch allergy swell ste site activity stop evaluate site verifying test remain line leave site;1;Employee;Attack, Rush away, Take, Bite, Evaluate, Verify, Stop, Remain, Leave;Glove, Uniform
Male;Employee;Vehicles and Mobile Equipment;March;employee hitchhike cep truck equipment cross central canterio track catch key wheel loader operator stop opposite direction return truck hit arm leave loader tire travel road pass cep right;5;Employee, Operator;Hitchhike, Cross, Catch, Stop, Return, Hit, Leave, Travel, Pass;Key, Wheel loader
Male;Third Party (Remote);Fall;March;approx collaborator mr sampler prepare change remove bucket pulp sample plant courier slip fall ground support right hand generating lesion describe;3;Collaborator, Sampler;Prepare, Change, Remove, Slip, Fall, Generate;Bucket, Pulp sample plant
Male;Third Party;Others;March;pm perform mag activity employee move acquisition line come small drainage approximately 40 cm wide small gap traverse drainage employee rest right foot ravine come rest cause right ankle twist soon twist activity paralyze employee take local hospital xray take examination physician injury find small swelling release normal activity;1;Employee, Physician;Perform, Move, Acquire, Traverse, Rest, Twist, Take, Examine, Find;drainage
Male;Third Party;Vehicles and Mobile Equipment;March;level before f6 m license plate go level surface pilot try locate radio answer concrete plant distract crash vehicle leave gable vehicle turn right side happen copilot hit right hand fragment break glass window right vehicle;5;Pilot, Copilot;Try, Locate, Answer, Crash, Leave, Turn, Hit;Radio, Vehicle, Glass Window
Male;Third Party;Vehicles and Mobile Equipment;March;scoop head rpa cutoff point cro south unload visualize truck park light engine ignite inside thrust scoop find accumulate dismount operator stop scoop get tell driver truck leave find decide look driver cro south find it return scoop meter visualize light lamp shine direction gable approach find deceased lie scoop proceed immediate notice supervisory shift control center emergency center;5;Operator, Driver, Supervisor;Unload, Visualize, Park, Ignite, Find, Accumulate, Dismount, Stop, Tell, Leave, Decide, Look, Approach, Notice, Proceed;Truck, Light, Engine, Scoop, Lamp
Male;Third Party;Machine Protection;March;employee perform maintenance filter press filtration area grs dismantle clamp turn motion contact burr tip screw expose cause cut glove wound 3rd quirodactilo left hand;3;Employee;Perform maintenance, Dismantle, Turn, Contact, Expose, Cause cut, Wound;Filter press, Clamp, Burr, Tip screw, Glove
Male;Third Party;Individual protection equipment;March;nv chamber accumulation aggregate Employee cast shotcrete crown work pm perceive discomfort fog face decide choose use safety glass comfort continue throw shotcrete pm suffer projection shotcrete rebound particle leave eye;4;Employee;Cast, Perceive discomfort, Choose, Use, Continue, Throw, Suffer, Rebound;Shotcrete, Safety glass
Male;Third Party;Venomous Animals;March;team vms project perform soil collection xixás target members team move collection point another mr ahead team sting near collection point surprised swarm bee inside play near ground visibility wood hiss noise pass stump attack bee ste left arm uniform prick lip screen rip tangle branch escape;1;Employee;Perform, Move, Collect, Surprised, Sting, Pass, Attack, Prick, Rip, Tangle, Escape;soil
Male;Third Party;Venomous Animals;March;team vms project perform soil collection xixás target members team move collection point another mr ahead team sting near collection point surprised swarm bee inside play near ground visibility wood hiss noise pass stump attack bee ste left arm uniform prick lip screen rip tangle branch escape;1;Employee;Perform, Move, Collect, Surprised, Sting, Pass, Attack, Prick, Rip, Tangle, Escape;soil
Female;Employee;Chemical substances;March;preparation solubilization activity sample chapel maid move vial nitric acid detach doser cause projection region face upper limb;4;Maid;Move, Detach, Cause projection;Vial, Nitric acid, Doser
Male;Third Party (Remote);Power lock;March;activity change conveyor belt 11b feed primary mill no mechanic enter discharge chute m clean material time automatic sampler inside chute activate trap mechanic height chest time accident mechanic work area;5;Mechanic;Clean material;Automatic sampler, Conveyor belt
Male;Third Party (Remote);Power lock;March;approximately hour change cable z power cell lock cabinet z014 transformer loud noise follow oscillation electrical system moment collaborator company eissa find floor head inside adjoining cell z cabinet block assign work having receive electric shock;5;Collaborator, Company Eissa;Change, Find, Receive;Cable, Lock, Transformer, Electrical system
Male;Third Party;Vehicles and Mobile Equipment;March;mixer ecm incimmet sa move positive south ramp direction surface unicon concrete plant height before operator observe untimely light engine off control control respond equipment start reverse meter operator jump cabin meter team hit right gable turn leave area circumstance event presence personnel equipment affect;5;Operator, Team;Move, Observe, Respond, Start, Jump, Hit, Turn, Leave;Light engine, Control
Male;Employee;Others;March;technician magnetometric survey step thorn reaction immediately retreat lose balance magnetometer antenna break;1;Technician;Perform survey, Step, React, Retreat, Lose balance, Break;Antenna, Magnetometer
Male;Third Party;Fall prevention;March;employee report assist maintenance activity tower electrolysis step grp grid polymer floor move cause fall event take place stage displacement fall floor span receive effort employee fall 60 m grp floor gutter floor support structure employee fall low level 35 m grp floor;4;Employee;Report, Assist, Perform maintenance, Move, Fall, Displacement;GRP grid, Polymer floor, Support structure
Male;Employee;Chemical substances;April;employee report supervise activity ustulation near ball projection hot humped dust upper floor reach cervical neck region cause degree burn;3;Employee, Supervisor;Report, Supervise, Reach, Cause burn;Ball, Dust
Male;Employee;Suspended Loads;April;employee perform task hoisting bigbag contain waelz oxide perform hoisting employee suffer lowvoltage electric shock contact hoist attach handle bigbag it;4;Employee;Perform task, Hoisting, Suffer electric shock, Contact;Hoist, Bigbag, Handle
Male;Third Party (Remote);Others;April;employee move structure post come step false suffering twisting leave ankle;3;Employee;Move structure, Suffer twisting, Leave ankle;structure
Male;Third Party;Venomous Animals;April;30hs current sediment activity collaborator take bee ste neck screen bee enter screen sting team decide leave workplace presence bee collaborator reaction continue work normally;1;Collaborator;Take bee sting, Decide leave workplace, Continue work normally;Screen
Male;Third Party;Others;April;industrial cleaning Employee cristian perform clean activity gutter strike wall same remove solid solution form moment operator hand slide impact edge gutter cause blow little finger leave hand;2;Operator, Industrial cleaning Employee;Perform clean activity, Strike wall, Remove solid solution, Slide hand, Impact edge gutter, Cause blow;gutter
Male;Third Party;Fall prevention;April;level formerly level hydraulic filling personnel perform installation diameter hdpe pipe ventilation chimney help yard scooptram hold push end pipe pipe meter length moment pipe get stuck edge chimney cause pipe form arc height injure Employee be signal light lamp operator scooptram stop try retire line fire Employee lose balance light contact pipe cause fall level;4;Operator;Perform installation, Help, Hold, Push, Get stuck, Try to retire, Lose balance, Contact pipe, Fall;Hydraulic filling equipment, HDPE pipe, Ventilation chimney, Yard scooptram, Signal light lamp
Male;Third Party;Chemical substances;April;employee perform paint floor fuel tank area need clean pour waterthinn floor bucket slip hand mixture project leave shoulder low lip cause redness burn;2;Employee;Perform paint, Clean, Pour, Slip, Project, Leave, Cause;Bucket, Mixture
Male;Third Party;Venomous Animals;April;execution soil sample task potion area pm open machete bite wasp right hand time incident epi needed activity employee evaluate technician find mild localize swelling wound employee report feel pain continue activity;1;Employee, Technician;Execute soil sample task, Open, Bite, Evaluate, Find, Report, Feel, Continue;Machete, Epi (epinephrine)
