Genre;Employee or Third Party;Critical Risk;Month;Cleaned_Description;Potential Accident Level Encoded;Positions;Actions;Tools_and_equipment
Male;Third Party;Pressed;January;remove drill rod jumbo maintenance supervisor proceed loosen support intermediate centralizer facilitate removal see mechanic support end drill equipment pull hand bar accelerate removal this moment bar slide point support tighten finger mechanic drilling bar beam jumbo;4;Maintenance Supervisor, Mechanic;Remove, Proceed, Loosen, Facilitate;Drill rod, Jumbo, Hand bar
Male;Employee;Pressurized Systems;January;activation sodium sulphide pump pipe uncoupled sulfide solution design area reach maid immediately use emergency shower direct ambulatory doctor later hospital note sulphide solution gram liter;4;Maid;Reach, Use;Sodium sulphide pump
Male;Third Party (Remote);Manual Tools;January;substation milpo locate level collaborator excavation work pick hand tool hit rock flat beak bounce hit steel tip safety shoe metatarsal area ​​the left foot collaborator cause injury;3;Collaborator;Excavation work;Hand tool
Male;Third Party;Others;January;be approximately nv cx ob7 personnel begin task unlock soquet bolt bhb machine penultimate bolt identify hexagonal head wear proceed mr auxiliary assistant climb platform exert pressure hand dado key prevent come bolt moment collaborator rotate lever anticlockwise direction leave key bolt hit palm leave hand cause injury;1;Auxiliary assistant, Collaborator;Unlock, Identify hexagonal head, Climb platform, Exert pressure hand;Soquet bolt, BHB machine, Dado key, Hexagonal head, Lever
Male;Third Party;Others;January;approximately be circumstance mechanic group leader the company impromec perform removal pulley motor pump zaf marcy length weight kg lock proceed heating pulley loosen it come falls distance meter high hit instep right foot Employee cause injury describe;4;Mechanic;Perform, Removal, Lock, Proceed, Heating, Loosen;Pulley motor
Male;Third Party (Remote);Pressurized Systems;January;unload operation ustulado need unclog discharge mouth silo truck perform procedure maneuver unhook hose total depressurisation mouth project ustulado powder collaborator cause irritation eye;3;Collaborator;Unload operation, Unclog discharge mouth;Silo truck
Male;Employee;Fall prevention (same level);January;collaborator report street hold left hand volumetric balloon slip place hand ground volumetric balloon end break cause small wound leave hand;3;Collaborator;Hold;Volumetric balloon
Male;Third Party;Pressed;January;approximately pm mechanic technician tecnomin verify transmission belt hm pump acid plant proceed turn pulley manually unexpectedly instant electrician supervisor grab transmission belt verify tension point finger trap;3;Mechanic technician, Electrician supervisor, Mechanic, Technician, Electrician;Turn pulley manually, Grab transmission belt;Transmission belt HM pump
Male;Third Party (Remote);Others;January;employee sit rest area level raise bore suffer sudden illness fall suffering excoriation face;4;Employee;suffer sudden illness;raise bore
Male;Third Party;Chemical substances;January;moment forklift operator go manipulate big bag bioxide section ladder lead area ​​manual displacement splash spend height forehead fissure pipe subsequently spill leave eye collaborator go nearby eyewash clean immediately medical center;2;Forklift operator, Collaborator, Operator;Manipulate, Displacement, Splash, Spill, Leave, Clean;Forklift, Ladder
Male;Employee;Others;January;instal segment polyurethane pulley protective lyner 60x4x5 cm weigh head pulley ore winch pulley rotate compress lyner inside channel fall housing rub right Employee hip generating injury describe;3;Employee;Install, Rotate, Compress, Fall, Rub;Polyurethane pulley, Winch pulley
Male;Third Party;Others;January;prepare rice lunch day move pot weight include content evacuate residual water cooking rice positioning pot jaba tilt backwards spill hot water cook leg cook immediately event apply aid pour cold water area ​​the injury medical post evaluation;4;Cook;Prepare, Move;Pot, Residual water, Jaba, Cold water
Male;Employee;Liquid Metal;February;collaborator report work ustulación realize cyclone duct obstruct open door try unclog material detach project employee cause small burn right heel;1;Collaborator;Try unclog material, Detach project;Cyclone duct
Male;Third Party;Electrical installation;February;moment operator jumbo try energize equipment proceed installation split set intersection remove lock open electric board 440v 400a lift thermomagnetic key make phase ground phase contact panel shell produce flash reach operator cause injury describe;5;Operator;Energize, Proceed, Install, Split, Remove, Open;Split set intersection, Electric board, Thermomagnetic key, Panel shell, Key
Male;Employee;Confined space;February;accumulation conveyor trailer filter 08fi0502 employee perform clean shutter air lance surprise fall product door pass neck collar aramid jacket cause burn neck shoulder;3;Employee;Perform, Clean;Air lance, Shutter, Trailer, Filter
Male;Employee;Liquid Metal;February;employee work thermal shock cause splash zinc direction employee despite indicate ppe hit small spatter pass facila hood small burn face region;4;Employee;indicate;zinc
Male;Third Party;Others;February;level circumstance Employee company perform task diamond drilling assistant injure prepare increase perforation pipe locate scaffold mr lift end tube support pulley equipment frame end work scaffold moment mr lift end pipe scaffold position frame upper pipe come pulley fall strike right hand Employee jhonatan bolt lateral frame cause injury describe;4;Employee, Assistant;Perform task, Injure, Prepare, Locate, Lift;Scaffold, Bolt, Diamond drilling, Pipe, Pulley, Frame
Female;Third Party;Others;February;overheat bar row cell spark produce project manage reach chief guard corridor produce degree burn neck;2;Chief guard;Manage, Reach, Produce;Bar
Male;Employee;Others;February;auxiliary wheel cathode crane g2133 change area bear heated hit hammer chisel end bear track detachment bearing piece occur impact thigh right leg produce cut ambulance call transfer clinic;2;Employee;bear, heated, hit, hammer chisel;auxiliary wheel, cathode crane, hammer, chisel, bearing piece
Male;Employee;Others;February;Employee make disconnection power cable gate intersection street cajamarquilla order remove it circumstance mr Employee company its remove rope tie body gate yield fall pull warn post hit helmet mr stand side;3;Employee;Remove rope tie, Make disconnection;Power cable, Rope
Male;Third Party;Others;February;operator open container subsequent loading silver concentrate open gate afterwards try open second door product open latter open impact handle safety lens generate injury leave cheekbone face operator;2;Operator;Open, Try;Container, Gate, Door, Handle
Male;Third Party;Others;February;chamber operator assistant remove drilling bar 71r drilling machine weight approx hold stroke assist jibs horizontally operator jib slide move drill bar cause assistant bar enforce assistant hand bar piston equipment;4;Operator, Assistant;Remove, Hold, Assist;Drilling bar, Drilling machine, Jib, Piston
Male;Third Party;Others;February;align right bracket tower release tension apply tirford tn push lever tension release point return mechanical effect overcome resistance lineman operator reshape hand assistant beat assistant frontal region;4;Operator, Assistant, Lineman;Align, Release, Apply, Push, Reshape, Beat;Bracket, Lever, Tirford TN
Male;Third Party (Remote);Others;February;loosen a30 truck steer cylinder bolt power cable socket force exert favor equipment bolt suddenly retire employee hit hand structure equipment cause injury;2;Employee;loosen steer cylinder bolt, force exert, hit hand;truck, steer cylinder, bolt, power cable, socket
Male;Third Party;Others;February;operator g deslaminadora section unlock sheet zinc stuck enter slide stack table require support mr helps hold sheet place entry chute slide moment release blade tilt brush mr left leg collaborator go nearby eyewash clean immediately medical center;2;Collaborator, Operator;Unlock, Enter, Slide, Hold, Release, Tilt;Sheet, Blade, Brush
Male;Employee;Manual Tools;February;operator willing manually displace zinc sheet adhere aluminum cathode moment blade detach blade release cathode bend graze collaborator right hand produce small cut knuckle finger Employee use glove leather Employee transfer medical unit aid;2;Collaborator, Operator;Manually displace, Adhere, Detach, Release, Bend, Graze;Zinc sheet, Aluminum cathode, Blade, Leather glove
Male;Employee;Others;February;end lunch enable place winche control room get short walk slip sit floor make contact leave knee take importance rest guard guard finish go safety communicate fact reason derive natclar attention;1;Employee;Get short walk slip, Sit floor, Make contact;Winche
Male;Third Party;Others;February;end rock break intersection ramp opening access ventilation chimney master loader identify rock mesh proceed unload they end decide verify remain position line fire time fragment rock fall 5x4x3 cm cocada mesh impact lens helmet cause injury;3;Master loader;Identify rock mesh;Mesh
Male;Employee;Others;February;Employee carry work level stop place metal mesh basket soil half scissor mesh fall hit right hand;4;Employee;carry, work level, place metal mesh, fall, hit;metal mesh, basket, soil, scissor
Male;Employee;Others;February;griff wrench unscrew rod probe key come press employee finger probe;3;Employee;unscrew, press, finger probe;griff wrench, probe, key
Male;Employee;Others;February;plant operator semikneele lift lid gate kg distributor box secondary mill no no right knee slip presence debris spill platform floor grating give extra effort leave leg generate muscle contracture;2;Operator;lift lid, give extra effort;gate, distributor box, secondary mill, platform, floor grating
Male;Employee;Others;February;level access times engineer trainee planamieto enter verify split set place scissor support hold notebook pen leave hand inspect roof work lose balance step rock hold right hand rock floor cause injury Employee time accident wear glove use difficult note;2;Engineer trainee;set, hold;scissor, notebook, pen, rock
Male;Third Party;Others;February;Employee work barretilla stop level unloading metal mesh basket ampoloader operator barretilla embed safety boot react immediately Employee remove limb force manage release foot produce wound right foot;4;Ampoloader operator;unload, embed;barretilla, metal mesh, basket
Male;Third Party;Others;February;approximately pm circumstance shotcrete launch nv ob2b finish launch mixkret assistant alpha mr ask operator mixkret mr mixkret access find cockpit mixkret operator team mr ask come down team start notice mr injure imprison team height leave rear rim hastial labor;5;Mixkret operator;launch, come down;Mixkret, shotcrete, cockpit
Male;Employee;Others;February;employee clearing pipe tap right thumb flange cause little trauma;2;Employee;clearing;pipe, tap, flange
Male;Third Party (Remote);Pressed;February;replace telescopic expansion joint hdpe pipe storm drainage pumping system report piece involuntarily move positioned holder press finger holder cause wound right chemo;3;Employee;Replace telescopic expansion joint;Telescopic expansion joint HDPE pipe
Male;Third Party;Others;February;withdrawal kelly bar conductive bar kg length diameter equipment perforation Employee position low tie bar injure position upper hold bar position bar platform lose control bar move 2nd finger right hand pulley frame time accident Employee wear safety glove drill rig block;4;Employee;withdrawal, hold, move;conductive bar, platform, pulley, frame, drill rig, block, safety glove
Male;Employee;Others;February;start activity remove coil electric cable warehouse help forklift truck operator notice beehive it movement coil bee excite realize fact operator turn equipment leave area people pass stung;5;forklift truck operator;start activity, remove, help;Electric cable, coil, forklift truck
Female;Third Party;Others;February;start activity remove coil electric cable warehouse help forklift truck operator notice beehive it movement coil bee excite realize fact operator turn equipment leave area people pass stung;5;forklift truck operator;start activity, remove, help;Electric cable, coil, forklift truck
Male;Employee;Others;February;preuse inspection jumbo check list equipment operator equipment find seat plastic bottle fill liquid apparently mineral water label labeling bottle small sip liquid expel immediately notice water immediately proceed wash water transfer medical center attention liquid contact esengrasante product equipment machinery low toxicity;4;Operator;preuse inspection, find, label;Jumbo, esengrasante product
Male;Employee;Others;February;maintenance flyght pump rotor oil pressure lubrication chamber cause chamber cover project employee face strike superficially forehead cause injury;4;Employee;maintenance, strike;pump, rotor, oil, pressure, lubrication, chamber, chamber cover
Male;Third Party (Remote);Pressurized Systems / Chemical Substances;February;approx leakage sulfur dioxide so2 section water seal blow overpressure acid plant moment collaborator cormei company eissa cosapi work near impact area evacuate medical center care return usual work;4;collaborator;work near impact area;dioxide so2
Male;Third Party;Others;February;perform cut mesh protrude gable work assistant loader position 40mt floor portable ladder hold base master loader time loader assistant lose balance fall hold mesh hand hang 80mt floor cause injury;3;Master loader, Assistant loader;cut, protrude, position, hold;mesh, portable ladder
Male;Employee;Pressed;March;operator center demag iv perform maintenance transport hydraulic cylinder help operator official unbalanced come cylinder carry press finger leave thumb pillar support oven specify figure;3;Operator;perform maintenance, transport, help, press;Hydraulic cylinder, oven
Male;Employee;Blocking and isolation of energies;March;start neutral leach process employee jhonatan proceed open air valve tank airlift circumstance process solution return chimney solution come contact arm right foot;3;Employee;open air valve, contact;air valve, tank, chimney
Male;Third Party;Others;March;time assistant carry bag cement weigh lamp loader suspend floor leave foot assistant slid hit edge baton;3;assistant;carry bag, suspend;cement, lamp, loader, baton
Male;Employee;Manual Tools;March;operator clean spatula spear window boiler time force action hit window frame cause injury little finger leave hand operator epp boiler cleaning;3;Operator;Clean spatula spear window boiler;Spatula spear window boiler
Male;Employee;Others;March;locomotive no operate maperu personnel direct wagon load ore op4 waste waste patrol car which go wagon moment pass change track leave rear wheel patrol car leave rail advance locomotive leave patrol car tilt ahead assistant motorist travel patrol car remain inside structure suffer minor bruise;4;assistant, motorist;operate, direct, load, patrol, pass;Locomotive, wagon
Male;Employee;Others;March;pit level radial drilling perform negative hole simba m4c ith no equipment assistant equipment operator change drill bit metal bar hammer release coupling rotation unit abruptly withdraw hand hit right hand team structure time accident team;3;Equipment assistant, Operator;Change drill bit, Release coupling;Metal bar hammer
Male;Third Party (Remote);Others;March;time Employee partner prepare oil cylinder gallon mobile platform mount rail platform weigh approximately kg derail leave rail order place platform rail Employee lift platform instant right hand trap rail platform structure hold metallic tube protrude platform accident cause bruise wound index finger right hand fracture time accident wear leathertype safety glove;4;partner;prepare, mount, weigh, derail;Oil, cylinder, gallon, platform, rail
Male;Third Party;Suspended Loads;March;operator feed bag big bag contain scrap sheet lift loaded bag release hook hoist make abrupt contact liquid zinc furnace generate explosion cause operator hit liquid zinc;4;Operator;feed, lift, release, make abrupt contact;Hoist, bag, scrap sheet, hook, liquid zinc, furnace
Male;Third Party;Others;March;circumstance Employee company incimmet loading explosive equipment anfoloader work sustain shotcreterepentinamente right superior crown piece rock approx kg 2mx015mx010 m impact basket helper basket suspend height moment later block rock detach wall gable approx kg 20mx110mx040 m impact ampoloader team block injure operator ampoloader team stand ground equipment anfoloader cabin protection rop fop time accident Employee helmet safety boot suffer polyontusion minor scoria injury;5;helper, operator;loading explosive;explosive equipment, anfoloader, rop, fop
Male;Third Party;Others;March;circumstance Employee company incimmet fectuaban loading explosive equipment anfoloader work sustain shotcreterepentinamente right superior crown piece rock approx kg 2mx015mx010 m impact basket helper basket suspend height moment later block rock detach wall gable approx kg 20mx110mx040 m impact ampoloader team block injure operator ampoloader team stand ground equipment anfoloader cabin protection rop fop time accident Employee helmet safety boot suffer polyontusion minor scoria injury;5;helper, operator;loading explosive;explosive equipment, anfoloader, rop, fop
Male;Third Party (Remote);Others;March;mechanic assistant throw wooden block support stabilizer hiab crane truck ground descend truck access ladder arrive step jump ground height 69 cm tread edge wooden block cause injury leave ankle;4;Mechanic;throw, support, descend, access, arrive, step, jump, tread, cause, leave;wooden block, stabilizer, hiab crane, truck, ladder
Male;Employee;Others;March;manually move steel cabinet disposal help employee operator finger press wall cabinet cause injury;4;Operator;move, help, press, cause;steel cabinet, wall cabinet
Male;Third Party (Remote);Chemical substances;March;discharge waste operator proceed remove bag roll circumstance end move direction face driver project liquid contain impacting ear face;3;operator, driver;discharge, proceed, remove, move, face, contain, impact;waste, bag, roll, liquid
Male;Employee;Others;March;circumstance operator go level level notice hydraulic pump inspection cover x32 approx fall stop equipment activate cat climb upper equipment moment accommodate cover slide middle finger cause injury;3;Operator;go, notice, inspect, fall, stop, activate, climb, accommodate, slide, cause;Hydraulic pump
Male;Third Party;Others;March;instal ripp pin tractor d6tn1 ripper support arm slide press second finger right hand base ripper cause injury describe;2;Employee;install, press;ripper, tractor
Male;Employee;Pressed;March;employee report lower cloth purification arrange cart grab pipe press left hand cloth cart;2;Employee;press;cloth, cart, pipe
Male;Third Party;Others;March;end loading explosive work front master loader enter verify mooring blast accessory retire m hear sound fragment rock rolling support mesh direct gaze crown vertical form point small fragment rock 2x3x2 cm 36gr pass opening mesh sustain impact forehead time event collaborator helmet safety lens support sacrifice mesh opening support mesh;2;master loader, collaborator;end, work, enter, verify, retire, hear, roll, support, direct, gaze, pass, sustain, impact, sacrifice;xplosive, mooring, blast accessory, support mesh, helmet, safety lens
Male;Employee;Manual Tools;March;employee perform adjustment tighten operation cutter blade work neglect key slip cause blade equipment hit he cause blunt cut right forearm;2;Employee;perform adjustment, tighten, neglect;key, cutter blade
Male;Third Party;Others;March;approximately be circumstance messrs truck crane culminate shipment block metal plate approximate weight mr cross rigger climb truck remove sling place foot stretcher support metal plate moment central stretcher break result foot imprison produce injury;4;rigger;culminate, climb, remove, place, support, break, imprison, produce;truck, crane, sling, stretcher, metal plate
Male;Employee;Others;March;placement support mesh cloth work moment ground injure collaborator reach electrowelded mesh operator scissor bolter position basket press mesh protruding end mesh cross leather glove cause injury right hand;3;Collaborator, Operator;placement, work, injure, reach, position, press, protrude, cause;support mesh, cloth, electrowelded mesh, scissor, bolter, basket, leather glove
Male;Employee;Chemical substances;March;employee check acid leakage shipping area hit splash solution right hemiface;4;Employee;check, hit, splash solution;acid solution
Male;Employee;Fall prevention (same level);March;employee clear liquid zinc pump oven step platform unbalanced twist leave foot;4;Employee;clear, leave, twist, foot;pump, oven, platform, liquid zinc
Male;Employee;Chemical substances;March;employee transit cadmium factory near tank copper sulphate acid solution spill direction reach leg cause minor burn;4;Employee;transit, reach, cause minor burn;cadmium, copper sulphate, acid solution, tank
Male;Employee;Others;March;carry activity cut electrowelded mesh work front assistant position foot end mesh leave end free moment assistant bend cut shear end free mesh return inertia hit partner safety len;2;assistant, partner;carry, cut, work, position, leave, bend, shear, return, hit;electrowelded mesh, safety lens
Male;Third Party;Others;March;refurbishment work hdpe pipe of diameter Employee Employee secure pipe chain stand basket ampoloader raise height ground pipe slip impact arm right cause injury radius right arm;4;Employee;refurbishment work, secure, stand, raise, slip, impact, cause injury;HDPE pipe, chain, basket, ampoloader
Male;Third Party;Others;March;circumstance dump truck laden ore enter unload backwards curve upper operator notice unevenness road approximately meter approach edge overturn truck right side operator travel truck use safety belt helmet glass time accident unloading process square accident site test alcohot operator negative;4;Operator;dump, enter, unload, notice, approach, overturn, travel, test;dump truck, safety belt, helmet, glass
Male;Third Party;Others;March;approximately pm level circumstance Employee company rock perform anchorage central pin anchor drill machine diamantina xrd bob cat assistant cristian injure adjustment nut central bolt stilson key no control panel movement rotation unit position clamp pin moment frame slid press thumb assistant leave hand stilson key cause describe injury lack secure frame fix bolt;4;Employee, assistant;perform, anchor, drill, injure, adjust, clamp, slide, press, leave, cause, describe, fix;rock, anchorage, pin, anchor, drill machine, diamantina, XRD, Bobcat, nut, central bolt, Stilson key, control panel, unit, frame
Male;Employee;Others;March;having carry mechanized support scissor heavy equipment operator pick water supply hose drum equipment and head cabin scissor way piece rock high approx displace slide right foot cause injury describe;3;Operator;carry, support, pick, displace, slide, cause, describe;mechanized scissor, heavy equipment, water supply hose, drum, equipment, head cabin, piece of rock
Male;Employee;Others;March;approximately supervise line clamp pom d071 return thickener d1304 hit nose metal chute operation;3;supervisor;supervise, return, hit, operate;line clamp, Pom D071, thickener D1304, metal chute
Male;Third Party (Remote);Pressed;March;employee perform truck unload operation iron bundle press right finger injure left arm;3;Employee;Unload operation, Perform truck unload operation;truck, iron bundle
Male;Third Party;Others;April;loading blow hole previous blast use telescopic ladder master loader pull ladder detach upper support point mt height fragment rock 3 cm 3 cm cm project right end ladder hit master loader cheekbone upper lip produce lesion describe master shipper safety glass;3;Master loader, Master shipper;Detach upper support point;Telescopic ladder
Male;Third Party;Others;April;plant stop schedule maintenance end change t fit hdp pipe diameter resident enter work zone supervise work moment Employee anchor harness upper manipulating accessory t tie flange hdp pipe pvc diameter suddenly pvc pipe come support pipe fine material tailing weight 700 kg fall height meter floor bounce imprison resident engineer injure Employee low line fire;5;Resident engineer;stop, schedule, change, enter, supervise, manipulate, tie, fall, bounce, imprison, injure;HDPE pipe, PVC pipe, flange, accessory, harness, work zone, support pipe, material tailing
Male;Employee;Others;April;parking equipment maintenance workshop mechanic ask operator equipment washing operator start reverse gear cab door fully open reach washing area meter behind brake cabin door close untimely hit face cause minor injury area mechanic floor level safe place;3;Mechanic, Operator;ask, start, reverse, open, reach, close, hit, cause;equipment, cab door, washing area, brake, cabin door
Male;Third Party (Remote);Others;April;circumstance Employee abratech company putty work inside conditioning tank meter deep cover platform metal grating grate upper part employee hyt company carry maneuver transfer pump help manual tick work hooked beam drag pump metal grating grate suddenly pump hooked metal grate grate try release it metal grid grate kg cm fall inside tank hit diagonal channel inside tank impact right arm Employee rub helmet second Employee crouch area bomb move marked tape lookout;5;Employee, Employee, second Employee;put, work, cover, carry, maneuver, transfer, help, hook, drag, try, release, rub, crouch, move, lookout;putty, conditioning tank, platform, metal grating, pump, manual tick, beam, metal grid, marked tape, helmet
