Male;Third Party (Remote);Others;April;circumstance Employee abratech company putty work inside conditioning tank meter deep cover platform metal grating grate upper part employee hyt company carry maneuver transfer pump help manual tick work hooked beam drag pump metal grating grate suddenly pump hooked metal grate grate try release it metal grid grate kg cm fall inside tank hit diagonal channel inside tank impact right arm Employee rub helmet second Employee crouch area bomb move marked tape lookout;5;Employee, Employee, second Employee;put, work, cover, carry, maneuver, transfer, help, hook, drag, try, release, rub, crouch, move, lookout;putty, conditioning tank, platform, metal grating, pump, manual tick, beam, metal grid, marked tape, helmet
Male;Third Party;Others;March;access santa novo area order open chop general move ahead team order open access come area steep slope gravel presence certain place access employee slip come unbalanced moment machete leave hand come slip right leg knee cause cut 3 cm;2;Employee;access, order, open, move, come, slip, unbalanced, leave, cause, cut;machete, gravel
Male;Third Party;Poll;March;perform sleeve removal maneuver hole meter deep general press lock nut rod jack hold entire weight rod maneuver lock procedure effective weight rod secure steel wire rope probe winch moment driller release brake winch inefficacy lock chestnut aid monkey cause slide rod auxiliary prepared manual unlock rod hold faucet key firmly probe tower composition shift stem slide hand shift downward cause left hand strike base probe tower structure cause cut 4th 5th quirodactyl employee take hospital go medical care wound suture stitch remove day activity;4;Employee;perform, remove, maneuver, press, lock, hold, secure, probe, release, shift, slide, strike, cause, take, go, remove;sleeve, hole, nut, rod, jack, steel wire rope, winch, driller, chestnut aid, monkey (possibly a type of tool), faucet key, probe tower
Male;Third Party;Others;March;trip vehicle end work collaborator step object identify come pierce sole boot cause small hole sole left foot collaborator perforation possibly stump wood area cover collaborator pasture graze recently near residence;1;Collaborator;trip, step, identify, pierce, cause, cover, graze;vehicle, object, boot, sole, stump, wood
Male;Third Party;Others;March;workshop level box mechanic manipulate steel plate 60 cm x40 cm 5 cm place gutter workshop able remove scaler plate slide restrict right ring finger gable plate cause injury collaborator glove time accident;2;Collaborator, Mechanic;manipulate, place, remove, slide, restrict, cause;steel plate, gutter, scaler, glove
Male;Employee;Manual Tools;April;open suction valve bo acid pump cable pump come loose press 5th finger employee leave hand tubing cause fracture distal phalanx photo;4;Employee;open, press, leave, cause, fracture;suction valve, acid pump, cable, tubing
Male;Third Party;Fall prevention (same level);April;Employee carry disassembly scaffold body pulpomatic thickener d2251 dismantle base scaffold locate approximately meter high floor sump rivet anchor support platform break cause fall Employee impact right knee support anchor horizontal scaffold structure;3;Employee;carry, disassembly, dismantle, locate, cause fall, impact;scaffold, pulpomatic thickener, base scaffold, rivet anchor, support platform
Male;Third Party;Pressed;April;employee report handle air conditioning press 2nd right chirodactilo cause contusion;3;Employee;report, handle, press, cause contusion;air conditioning
Male;Third Party;Others;April;park van cluster wooden sleeper board driver descend step board iron nail protruded long identify board submerge puddle water accident cause minor wound sole left foot time accident Employee wear safety boot;2;driver, Employee;park, descend, identify, submerge in puddle, cause minor wound;wooden sleeper board, iron nail, safety boot, board
Male;Employee;Others;April;maintenance locomotive workshop level assistant pull locomotive chair backwards stumble ventilation grille fall platform locomotive floor workshop height 17 m generate injury time accident assistant safety helmet chin strap;4;assistant;pull, stumble, fall, generate;locomotive, chair, ventilation grille, platform, safety helmet, chin strap
Male;Third Party;Others;April;machine lift weight tn floor level accidently proceed pull machine key ton maximum cap lie floor advance horizontally anchor bolt pig tail type diameter key hooked break transversely pull force key project injure person leave shoulder cause injury injure meter key time incident assistant meter away order clean;4;assistant;lift, proceed, pull, advance, anchor, break, project, injure, leave, clean;machine, key, anchor bolt, pig tail (type), diameter key
Male;Employee;Others;April;position scissor bolter east stope meter top operator assistant verify ventilation sleeve obstruct support leave gable decide section sleeve direct main corridor injure person decide climb roof equipment cabin surface square meter carry reinstallation sectioned sleeve and noticing step fall equipment height meter time accident operator scissor bolter platform equipment position block perform maintenance assistant wear safety helmet chin strap;4;Operator;position, verify, obstruct, support, leave, decide, direct, injure, climb, carry, reinstallation, notice, fall, perform maintenance;scissor bolter, ventilation sleeve, equipment, cabin, platform, block, safety helmet, chin strap
Male;Employee;Pressurized Systems;April;clean vertical pipe hydrojet equipment high pressure hose hose return obstruction pipe residue reach operator actuate equipment pedal;3;Operator;clean, return, reach, actuate;vertical pipe, hydrojet equipment, high pressure hose, pedal
Male;Third Party;Others;April;bypass level Employee company operator bolter bolt team rolando assistant retire installing support helical bolt pink team mesh overhang gable teacher tell assistant cut mesh instant assistant finish cut mesh suddenly rise hit face cause injury describe;2;Operator, Assistant, Teacher, Operator bolter;bypass, install, retire, support, overhang, cut, finish, rise, hit, cause, describe;bolter, bolt, helical bolt, mesh
Male;Third Party;Others;April;be approximately luna master loader company incimet carry loading activity cruiser level moment tie pentacord crown trying reach fanel leave side lose balance movement ladder fall floor result accident;3;Master loader;carry, load, tie, try, reach, leave, lose balance, fall, result;cruiser, pentacord, ladder, fanel
Male;Third Party;Others;April;moment Employeemechanic workshop maintenance wire mining lamp hooked drill hole kg work table workshop fell m impact leave foot cause minor bruise time accident collaborator safety boot steel toecap;3;Employee, mechanic, collaborator;hook, drill, fell, work, impact, leave, cause;wire, mining lamp, drill, work table, safety boot, steel toecap
Male;Employee;Others;April;general store store attendant remove compartment rubber mesh material classification mx1 mx0 weight lift approx position edge mesh place floor litter slightly imprison index finger right hand assistant cause minor cutting wound time accident injure Employee leather glove;2;Assistant, Store attendant;remove, classify, lift, position, place, imprison, cause, injure;rubber mesh, material, mesh, floor, leather glove
Male;Employee;Cut;April;employee report attempting manually ingot rotary table ingot hit leave hand angle structure ingot press finger ingot angle;4;Employee;attempt, manually, hit, leave, press;ingot, rotary table, structure
Male;Third Party;Others;April;move roll electrowelde mesh weight place hopper truck operator pull roll mesh bring hopper truck time imprisonment leave hand operator mesh body hopper generate describe injury time accident operator wear pvctype safety glove;3;Operator;move, roll, place, pull, bring, generate, describe, leave;electrowelded mesh, hopper, truck, PVCTYPE safety glove
Male;Employee;Others;April;perform clean lhd block level operator surprise rock block displacement gallery reach right leg cause superficial injury;5;operator;perform clean, surprise rock, block displacement, reach, cause superficial injury;LHD, Load-Haul-Dump
Male;Third Party;Others;April;workshop end welding work small bolter equipment welder proceed clean inside metal stool impregnate thin flammable liquid help hammer screwdriver proceed remove oxide hit screwdriver hammer produce flash internal base stool produce slight burn right hand welder time accident welder use glove leave hand;2;Welder;proceed, clean, impregnate, help, remove, hit, produce, burn, leave;bolter, equipment, metal stool, thin flammable liquid, hammer, screwdriver, glove
Male;Employee;Others;April;pm approximately ob5 mr service instant pick cat position truck crane plate acl raise right hand low cat indexed index finger leave hand body cylinder valve cat valve turntable upper part;3;service personnel;position, raise, indexed, leave, turn;truck, crane, plate, cylinder, valve, turntable
Male;Third Party;Pressurized Systems / Chemical Substances;April;employee report place air lance tank open manual air valve projection acid solution heat reach left thigh;4;Employee;place, open, reach, report;air lance, tank, manual air valve, acid solution
Female;Third Party;Cut;April;injure woman perform clean cleaning sink collection room pierce finger fragment glass;2;Employee;perform clean, cleaning, collection, pierce, injure;sink, fragment glass
Male;Third Party (Remote);Chemical substances;April;discharge sodium hydroxide disconnect employee place demineralization suction pump turn off receive projection pump sensor cause 1st degree burn;3;Employee;disconnect, place, turn off, receive projection, cause 1st degree burn;demineralization suction pump, pump sensor, sodium hydroxide
Male;Third Party;Others;April;mr operator concrete throwing team alpha shoot shotcrete work nv ob1 apply m3 realize additive come mix direct lift cover passage valve inch thickness approximately kg verify valve open release lid hit finger leave hand base cause injury;4;Operator;throw, shoot, apply, realize, come, mix, direct, lift, cover, verify, open, release, hit, leave, cause;shotcrete, valve, lid
Male;Employee;Pressed;April;employee perform return load entrance debark machine try align cathode press right hand;4;Employee;perform return load, debark machine, try align, press;cathode, machine
Male;Employee;Others;April;injure Employee begin work present support mesh cloth floor make initial cut mesh section ponchos originate remain mesh wick tip prong protrude try second mesh cut position edge remain mesh wick prevent curl point try shear remove right foot mesh cause mesh roll embed wick tip pole leave boot cause injury time accident Employee wear safety boot;2;Employee;begin work, present, support, make initial cut, try second, try shear remove, remove, detect, prevent, cause injury;cloth, mesh, ponchos, wick tip, prong, pole, shear
Male;Third Party;Others;April;ddh chamber company explomin locate level socorro ramp Employee assistant drillerwas dismantle fifth drill nq meter steel weight kg stilson key no moment operator operate rotation unit drill rotate press left hand Employee base holder cause injury leave hand time accident drill assistant rubber glove;4;Employee, assistant, operator, driller;locate, dismantle, operate, rotate, press, cause, leave;hamber, steel, stilson key, drill, base holder, rubber glove
Male;Third Party;Others;May;carry maneuver increase pipe line driller indicate assistant gilton introduce inner pipe drill assistant introduce inner pipe place hand box pipe driller noticing move pipe assistant hand open chuck rotation unit drop pipe imprison injure person right hand cause injury;4;driller, assistant, assistant;carry, maneuver, increase, indicate, introduce, place, open, rotation, drop, imprison, injure;pipe line, drill, inner pipe, box, chuck, rotation unit
Female;Third Party (Remote);Chemical substances;May;employee report climb access ladder operating room ustulation surprise projection sulfuric acid;4;Employee;report, climb access ladder, operating, surprise;ladder, sulfuric acid
Male;Third Party;Manual Tools;May;perform geological mapping activity necessary hammer rock analysis moment clerk hold it point fragment slip quirodactyl right hand cause superficial cut;1;Clerk;perform, hold, point, slip, cause;Hammer, Rock
Male;Third Party;Others;May;pm approximately nv cx mr helper jumbo remove drill rod drilling hole instant break chain subjection table drilling machine slide achieve rub index finger leave hand cause injury;4;helper;Drilling hole;Drill rod, Jumbo, Drilling machine
Male;Employee;Others;May;be approximately nv cx mr scoop observe polyethylene pipe throw road proceed low equipment find lift pipe hook right gable piece rock suspend lectrowelde mesh impacting operator right eyebrow cause injury;3;Operator;observe, throw, proceed, find, lift, hook, suspend, impact, cause;polyethylene pipe, equipment, piece of rock, electrowelded mesh
Female;Third Party (Remote);Chemical substances;May;conduct inspection evaluate activity carry pump house ustulation steam station hit sulfuric acid spill line locate pump house thermal recovery boiler;3;inspection;conduct inspection, spill;pump house, steam station, sulfuric acid spill line, thermal recovery boiler
Male;Third Party (Remote);Chemical substances;May;conduct inspection evaluate activity carry pump house ustulation steam station strike sulfuric acid spill line locate house thermal recovery boiler pump;3;inspection;conduct inspection, spill;pump house, steam station, sulfuric acid spill line, thermal recovery boiler
Male;Third Party;Manual Tools;May;employee sand piece electrolysis end operation protective cap disk spin leave hand;3;Employee;sand, protective, spin, leave hand;piece electrolysis, protective cap, disk
Male;Third Party (Remote);Manual Tools;May;die cut feeder pead geomembrane blanket weld seam store extruder stylet blade come direction leave forearm result blunt short injury;2;Employee;die cut, weld seam, store, come direction, leave forearm;pead geomembrane, blanket, extruder, stylet blade
Male;Third Party;Others;May;weld workshop level ex tunnel quinoa moment assistant raise wooden strut long diameter weight place work table height tread wooden strut place floor lose balance fall level lie laterally concrete wall cause bruise leave shoulder;3;assistant;raise, place, tread;wooden strut, work table, concrete wall
Male;Third Party (Remote);Chemical substances;May;sunday collaborator go medical center say accident day ago perform internal maintenance work heat exchanger define confine space risk burn acid leave confine space employee remove protective glove having pass emergency shower moment skin contact occur sulfate generate lesion;2;Collaborator;go, say, perform, define, confine, remove, pass, occur, generate;heat exchanger, protective glove, emergency shower, sulfate
Male;Third Party;Others;May;moment truck transport personnel company mceisa plate ajg move surface miss 50 m reach mouth gearbox respond driver stop truck inspect maintenance personnel time travel truck raise cabin manually change continue trip culminate task driver support maintenance personnel low cabin weight fall hit driver cabin hopper truck time accident employee wear safety helmet chin strap;4;driver, maintenance personnel;transport, move, miss, reach, respond, stop, inspect, raise, manually change, continue, culminate, fall, hit, wear;truck, gearbox, safety helmet
Male;Third Party;Others;May;complete welding work backhoe bucket hour glass moon welder feel slight discomfort eye transfer medical service evaluation accident welder facial mask welding;4;Welder;complete, feel, transfer, evaluate;backhoe bucket, welding equipment, hourglass, facial mask
Male;Employee;Others;May;employee milpo visit facility level wait personnel cage level drop water fall ceiling height meter approximately product slight filtration crown sustain shotcrete drop enter right eye cause discomfort right eye accord employee time accident lense remove clean they happen visit interior mine;2;Employee;visit facility;cage, shotcrete, lense, interior mine
Male;Third Party (Remote);Others;May;porvenir substation level assemble metal structure approximately kg support lift system operator try accommodate structure anchor base moment metallic structure slide direction injure Employee right hand produce slight right hand accretion head bolt base structure cause injury time accident operator use safety glove;4;Operator;assemble, lift, try, accommodate, anchor, slide, produce, cause, use;metal structure, support lift system, safety glove
Male;Employee;Others;May;employee perform carbon steel pipe mark activity helmet strike tube cause scalp wound impact helmet sheepskin;3;Employee;perform, mark, strike, cause;carbon steel pipe, helmet, sheepskin
Male;Employee;Blocking and isolation of energies;May;maintenance p205b pump projection silicate pulp reach right leg employee;3;Employee;maintenance;pump, silicate pulp
Male;Third Party;Fall prevention (same level);May;circumstance collaborator perform washing tabolas pot washing area suffer feel dizziness faintness cause fall level produce slight concussion head;1;Collaborator;perform, wash, suffer, feel, faint, cause, fall;tabolas, pot
Male;Third Party;Others;May;transit fuel tanker level level north ramp pass level operator feel right rear tire skid operator perform defensive maneuver truck hit leave gable cause injury describe time accident pilot copilot wear safety belt safety glass helmet;4;operator, pilot, copilot;pass, feel, skid, perform, maneuver, hit, leave, cause, describe;Truck, fuel tanker, safety belt, safety glass, helmet
Male;Third Party;Fall;May;field trip return work lunch employee wellfield company slip loose stone place moment intention balancing try hold tree fall right arm cause fracture distal end radius activity paralyze employee refer hospital paracatu undergo medical care;4;Employee;field trip;stone, tree
Male;Employee;Others;May;be approximately workshop mechanical maintenance surface mr boltec assistant mr cut link shorten distance chain hold injection hose resin instant see blade leave cut position affect second finger leave hand cause injury;3;assistant;cut link, hold injection hose resin, see blade, leave cut position;chain, injection hose resin, blade
Male;Employee;Others;May;test soft starter engine belt collaborator igor move site approximately fall trench electric cable 90 m deep find partially discover;3;Collaborator;Test soft starter engine belt;soft starter, engine, belt, electric cable
Male;Employee;Others;May;check voltage power outlet plug socket sure connection correct small electrical arc power cord cause slight burn right hand wrist protection system act immediately;5;Employee;Check voltage, Plug socket;power outlet, plug, socket, power cord, wrist protection system
Male;Third Party;Bees;May;ground team coordinate prospector assistant wila pm prong opening access collect soil sample come try divert meter right place moment diversion come marimbondo house he give time action thug agitate time ste head neck sting face allergy test verify allergic reaction wash affect return normal activity;1;prospector assistant;coordinate, opening access, collect soil sample, try divert, come marimbondo house;prong
Male;Third Party;Bees;May;geological reconnaissance activity farm mr team compose felipe normal activity encounter ciliary forest need enter forest verify rock outcrop front divine realize open access machete moment take bite neck attack allergic reaction continue work normally work complete leave forest access divine assistant attack snake suffer sting forehead moment move away area verify type allergic reaction return normal activity;1;Geological reconnaissance team, Assistant;Perform reconnaissance, Encounter, Enter, Verify, Realize, Use, Continue, Complete, Move away, Return;Rock, Machete
Male;Employee;Others;May;geological reconnaissance activity farm mr team compose felipe normal activity encounter ciliary forest need enter forest verify rock outcrop front divine realize open access machete moment take bite neck attack allergic reaction continue work normally work complete leave forest access divine assistant attack snake suffer sting forehead moment move away area verify type allergic reaction return normal activity;1;Geological reconnaissance team, Assistant;Perform reconnaissance, Encounter, Enter, Verify, Realize, Use, Continue, Complete, Move away, Return;Rock, Machete
Male;Employee;Cut;June;clerk peel pull sheet come strike 5th chirodactile leave hand tear pvc sleeve cause cut;3;clerk;peel, pull;sheet, PVC sleeve
Male;Employee;Cut;June;process washing material becker tip material break cause cut 5th finger right hand;3;Employee;process washing, break;becker tip
Male;Third Party;Others;June;circumstance collaborator perform cleaning ditch deep remove pipe hdpe material estimate weight kg collaborator push tube drain dune collaborator hit low right lip produce slight blow lip time event collaborator safety helmet glass glove;2;Collaborator;Perform cleaning, Remove, Push, Hit, Produce;HDPE pipe, Safety helmet, Glass, Glove
Male;Third Party;Others;June;pm approximately nv tecnomin winery mr alone cut wire no grinder previously remove protection guard disk inch diameter adapt disk crosscutter approximately inch originate traumatic amputation finger leave hand;5;Technician;Cut, Remove, Adapt, Originate;Wire, Grinder, Protection guard, Disk (inch diameter), Crosscutter
Male;Third Party;Others;June;field trip lajes target junior costa official step wooden stump ground approximately cm pierce boot wound sole right foot time accident employee ppe require activity hand free employee take hospital go medical care release return activity day work;2;Employee;field trip, step;wooden stump
Male;Employee;Others;June;level ore haul activity locomotive op2 bine times convoy travel hopper op1 assistant motorist ride saddle hold pole strike weakly split set suspend hdp pipeline gable work meter floor time accident assistant wear safety equipment wear seatbelt time accident set accompany movement path convoy;3;assistant, motorist;haul activity, ride saddle, hold pole, strike, set, suspend, work meter floor, accompany movement;locomotive, pole, hdp pipeline, saddle, convoy, hopper
Male;Employee;Fall prevention;June;employee work electrician management electrometallurgy suffer contusion right leg suffer slip height step staircase code ele abb furnace cat ladder immediately refer collaborator medical service treat;1;Employee, Electrician, Management, Collaborator;Work, Suffer, Slip, Refer, Treat;Code, Furnace, Ladder
Male;Third Party;Others;June;time Employee technician mr boltec cia want pass hand stacker sardinel technician pull hydraulic arm mr push nail equipment reach trench rim tie team turn forward fall technician;3;Technician;Pass, Pull, Push, Reach, Tie, Turn, Fall;Stacker, Sardinel, Hydraulic Arm, Nail, Equipment
Male;Employee;Others;June;circumstance employee connection electric cable no jumbo operator feel discomfort face clean hand rubber glove generate superficial laceration small wound leave cheekbone;1;Employee, Jumbo Operator;Connect, Feel Discomfort, Clean, Generate;Electric Cable, Rubber Glove
Male;Third Party;Others;June;phase iii concentrator plant maintenance personnel carry removal transmission belt flotation cell cleaning moment mechanic remove belt lean leave leg slide grating floor leave foot pipe generating lesion describe work carry floor level time accident staff safety equipment;3;Mechanic;Carry, Remove, Lean, Slide, Generate;Transmission Belt, Flotation Cell, Grating, Pipe
Male;Employee;Fall prevention (same level);June;approximately pm operator eustaquio fall metal platform give access tank d strong acid leach stage suffer luxofracture wrist leave lean floor hand operator direct tank strong acid leaching stage tk d verify entry spend taque;4;Operator;Fall, Give Access, Suffer, Lean, Verify;Metal Platform, Tank, Strong Acid, Leach Stage
Male;Third Party;Bees;June;project vazante carry sediment collection current south mata target drainage serra garrote team compose member wca company move collection point another inside shallow drainage see bee carton reaction away box quickly possible avoid sting run meter look safe area exit radius attack bee ss breno attack consequently suffer sting belly hand verify type allergic reaction return normal activity;1;Employee;Move, See, React, Avoid, Run, Look, Exit, Suffer, Verify, Return;Bee Carton
Male;Third Party;Others;June;project vazante carry sediment collection current south mata target drainage serra garrote team compose member wca company move collection point another inside shallow drainage see bee carton reaction away box quickly possible avoid sting run meter look safe area exit radius attack bee ss breno attack consequently suffer sting belly hand verify type allergic reaction return normal activity;1;Employee;Move, See, React, Avoid, Run, Look, Exit, Suffer, Verify, Return;Bee Carton
Male;Third Party (Remote);Manual Tools;June;employee report work brushcutter near stone blade equipment collide piece metal project leg cause injury leave leg;3;Employee;collide;brushcutter, blade, piece metal
Male;Employee;Others;June;mooring fanele detonate cord complete injure person proceed tie detonate cord safety guide slow wick distance meter work moment finish mooring rock bank 30 cm 50 cm 15 cm kg front height meter fall floor close injure disintegrate fragment 12cmx10cmx3 cm kg slide fragment rock impact leave leg victim time accident operator safety boot accompany supervisor;4;Operator;Detonate, Tie, Proceed, Complete, Finish, Work, Fall, Slide, Impact, Injure, Disintegrate, Accompany;Detonate Cord, Safety Guide, Wick, Safety Boot
